{
  "schema_version": 1,
  "binding_status": "BOUND",
  "product_id": "spectra",
  "repository_url": "https://github.com/sivla/BCProjectOS.git",
  "release_version": "1.2.3",
  "release_tag": "spectra-v1.2.3",
  "tag_commit": "aaaaaaaaaaaaaaaaaaaaaaaaaaaaaaaaaaaaaaaa",
  "manifest_path": "release/versions/1.2.3/release-manifest.json",
  "manifest_source_commit": "bbbbbbbbbbbbbbbbbbbbbbbbbbbbbbbbbbbbbbbb",
  "consumer_mode": "INSTALLABLE_BLUEPRINT",
  "installable_blueprint": true,
  "digest_algorithm": "SHA-256",
  "payload_bundle_digest": "cccccccccccccccccccccccccccccccccccccccccccccccccccccccccccccccc"
}
